<?xml version="1.0"   ?>
<wx 
	xmlns="https://raw.githubusercontent.com/wonder-sy0618/module-wx-service/"	
	xmlns:xsi="http://www.w3.org/2001/XMLSchema-instance"
	xsi:schemaLocation="
		https://raw.githubusercontent.com/wonder-sy0618/module-wx-service/ 
		wx-reply.xsd">




	<reply>
		
		<text match="音乐"  >
			<answer type="music" >
				<title>泡沫</title>
				<description>G.E.M.邓紫棋</description>
				<musicUrl>http://zhangmenshiting.baidu.com/data2/music/33795619/14945107241200128.mp3?xcode=9bc5d4c8ea6daa22663ac8488439b8fbf3b502c7ddf22793</musicUrl>
				<hqMusicUrl>http://zhangmenshiting.baidu.com/data2/music/33795619/14945107241200128.mp3?xcode=9bc5d4c8ea6daa22663ac8488439b8fbf3b502c7ddf22793</hqMusicUrl>
			</answer>
		</text>
		<text match="百度"  >
			<answer type="news" >
				<item>
					<title>百度搜索</title>
					<description>全球最大的中文搜索引擎、致力于让网民更便捷地获取信息，找到所求。百度超过千亿的中文网页数据库，可以瞬间找到相关的搜索结果。</description>
					<imageUrl>http://www.baidu.com/img/bdlogo.gif</imageUrl>
					<linkUrl>http://www.baidu.com/</linkUrl>
				</item>
			</answer>
		</text>
		
		<text match=".*"  >
			<answer type="text" >i'm text message, from xml config</answer>
		</text>
		
		<default accept="wx.accept.default"></default>
		
		<pic>
			<answer type="news" >
				<item>
					<title>百度搜索</title>
					<description>全球最大的中文搜索引擎、致力于让网民更便捷地获取信息，找到所求。百度超过千亿的中文网页数据库，可以瞬间找到相关的搜索结果。</description>
					<imageUrl>http://www.baidu.com/img/bdlogo.gif</imageUrl>
					<linkUrl>http://www.baidu.com/</linkUrl>
				</item>
				<item>
					<title>百度知道</title>
					<description>百度知道是由全球最大的中文搜索引擎百度自主研发、基于搜索的互动式知识问答分享平台。</description>
					<imageUrl>http://www.baidu.com/img/bdlogo.gif</imageUrl>
					<linkUrl>http://zhidao.baidu.com/</linkUrl>
				</item>
			</answer>
		</pic>
		
		<link>
			<answer type="news" >
				<item>
					<title>百度搜索</title>
					<description>全球最大的中文搜索引擎、致力于让网民更便捷地获取信息，找到所求。百度超过千亿的中文网页数据库，可以瞬间找到相关的搜索结果。</description>
					<imageUrl>http://www.baidu.com/img/bdlogo.gif</imageUrl>
					<linkUrl>http://www.baidu.com/</linkUrl>
				</item>
			</answer>
		</link>
		
		<geo>
			<answer type="music" >
				<title>i'm music message title, from xml config</title>
				<description>i'm music message description.</description>
				<musicUrl>http://zhangmenshiting.baidu.com/data2/music/33795619/14945107241200128.mp3?xcode=9bc5d4c8ea6daa22663ac8488439b8fbf3b502c7ddf22793</musicUrl>
				<hqMusicUrl>http://zhangmenshiting.baidu.com/data2/music/33795619/14945107241200128.mp3?xcode=9bc5d4c8ea6daa22663ac8488439b8fbf3b502c7ddf22793</hqMusicUrl>
			</answer>
		</geo>
		
	</reply>
	






 
</wx>